{
  "schema_version": "1.0",
  "revision": 1,
  "profile": {
    "base_profile": null,
    "spelling": "preserve",
    "report_language": "ru"
  },
  "rules": [
    {
      "id": "USR-001",
      "title": "Name competing comparison baselines",
      "category": "LANGUAGE",
      "instruction": "Name the compared quantity and baseline when more than one is plausible. Resolve them only from supplied text or evidence; otherwise ask the author.",
      "context": "Results sentences containing several possible comparison baselines.",
      "rationale": "The reader should not have to infer which estimate is compared.",
      "source": {
        "kind": "author",
        "reference": "Synthetic configuration example; adapt to the actual project."
      },
      "status": "active",
      "examples": [
        {
          "original": "The prediction error was measured. It was lower in these cities.",
          "preferred": "The prediction error was measured. The prediction error was lower in these cities."
        }
      ]
    }
  ],
  "lexicon": [
    {
      "id": "TERM-001",
      "expression": "transit",
      "action": "prefer",
      "preferred": "public transport",
      "context": "Ordinary references to public transport; retain quoted or defined terms such as transit desert.",
      "match_case": false,
      "source": {
        "kind": "author",
        "reference": "Synthetic vocabulary preference example."
      },
      "status": "active"
    }
  ]
}
